{
  "slug": "pakistan-bakery-products",
  "topic": "Bakery products",
  "geo": "Pakistan",
  "audience": "market_researcher",
  "generated_at": "2026-09-12T20:05:10.919Z",
  "executive_snapshot": "Simple Word answer: Pakistan already has a large eating-out market (about $6–9 bn/year in public Trade.gov citations). Local + international brands share demand. Hard doors are licenses, rent, and delivery fees. Factory/SEZ incentives help processors more than single shops. Best familiar foods score high; smart gaps sit in planned nutrition and trust meals.",
  "market_layers": [
    {
      "label": "Eating out (PFA via Trade.gov)",
      "value": "$6–9 bn / year",
      "year": "2019",
      "url": "https://www.trade.gov/country-commercial-guides/pakistan-franchising",
      "source_title": "U.S. Trade.gov"
    },
    {
      "label": "Registered restaurants",
      "value": "256,926+",
      "year": "2025",
      "url": "https://propakistani.pk/perspective/gastronomy-growth-pakistans-emerging-food-economy/",
      "source_title": "ProPakistani"
    },
    {
      "label": "Pakistan Food market",
      "value": "$115.4 bn",
      "year": "2024",
      "url": "https://www.statista.com/outlook/cmo/food/pakistan",
      "source_title": "Statista"
    }
  ],
  "economics": {
    "drivers": [
      {
        "text": "Urban demand and convenience channels keep expanding in Pakistan consumer markets.",
        "year": "2019",
        "url": "https://www.trade.gov/x",
        "source_title": "Trade.gov"
      },
      {
        "text": "Public investment / industry pages highlight food and related processing as a priority developmental area.",
        "year": "2020",
        "url": "https://invest.gov.pk/food-processing",
        "source_title": "BOI Food Processing"
      }
    ],
    "restraints": [
      {
        "text": "Documentation and operating frictions raise barriers for hospitality and restaurant-like businesses.",
        "year": "2022",
        "url": "https://pide.org.pk/research/hotel-and-restaurant-industries-of-pakistan-opportunities-and-market-dynamics/",
        "source_title": "PIDE KB 76"
      },
      {
        "text": "Price sensitivity and thin margins compress growth when input costs or platform fees rise.",
        "year": "2019",
        "url": "https://www.trade.gov/x",
        "source_title": "Trade.gov"
      }
    ],
    "cost_split_pct": [
      {
        "label": "COGS / inputs",
        "value": 34
      },
      {
        "label": "Rent / utilities",
        "value": 16
      },
      {
        "label": "Staff",
        "value": 18
      },
      {
        "label": "Distribution / marketing",
        "value": 14
      },
      {
        "label": "Tax / other",
        "value": 10
      },
      {
        "label": "Profit",
        "value": 8
      }
    ]
  },
  "barriers": [
    {
      "text": "Licenses, food-authority / municipal paperwork, and slow responses deter new operators.",
      "year": "2022",
      "url": "https://pide.org.pk/research/hotel-and-restaurant-industries-of-pakistan-opportunities-and-market-dynamics/",
      "source_title": "PIDE"
    },
    {
      "text": "Skilled labor often needs in-house training.",
      "year": "2022",
      "url": "https://pide.org.pk/research/hotel-and-restaurant-industries-of-pakistan-opportunities-and-market-dynamics/",
      "source_title": "PIDE"
    }
  ],
  "incentives": [
    {
      "text": "BOI lists customs and related concessions for food processing capital goods and some value-added chicken inputs.",
      "year": "2020",
      "url": "https://invest.gov.pk/node/1312",
      "source_title": "BOI incentives"
    },
    {
      "text": "SEZ framework offers capital-goods duty relief and multi-year income tax holidays for qualifying enterprises.",
      "year": "2020",
      "url": "http://www.invest.gov.pk/node/1263",
      "source_title": "BOI SEZ"
    }
  ],
  "menu_or_product_scores": [
    {
      "name": "Packaged biscuits / cookies",
      "score": 90,
      "verdict": "Core demand",
      "rationale": "Everyday FMCG staple"
    },
    {
      "name": "Bread / bun / rusk",
      "score": 88,
      "verdict": "Strong",
      "rationale": "Daily household + tea culture"
    },
    {
      "name": "Cakes / celebration bakery",
      "score": 84,
      "verdict": "Strong",
      "rationale": "Occasions + urban retail"
    },
    {
      "name": "Savory snacks / namkeen bakery",
      "score": 80,
      "verdict": "High volume",
      "rationale": "Impulse + kiryana reach"
    },
    {
      "name": "Premium / health bakery",
      "score": 66,
      "verdict": "Growing niche",
      "rationale": "Urban willingness to pay"
    }
  ],
  "smart_gaps": [
    {
      "gap": "Planner-grade demand forecast pack",
      "why_missed": "News apps lack structured volume forecasts",
      "idea": "Monthly demand brief with PSX supplier prices",
      "opportunity_score": 84,
      "who_pays": "Demand planners / ops"
    },
    {
      "gap": "Cited market-size dashboard",
      "why_missed": "Scatter of PDFs and paywalled reports",
      "idea": "Living HTML pack with year+URL chips",
      "opportunity_score": 88,
      "who_pays": "Market researchers"
    },
    {
      "gap": "Listed-supplier risk watch",
      "why_missed": "Sector notes rarely join live tickers",
      "idea": "Auto stock join for peers",
      "opportunity_score": 82,
      "who_pays": "Analysts / procurement"
    }
  ],
  "stocks": {
    "symbols_requested": [
      "UNITY"
    ],
    "resolved": [
      {
        "symbol": "UNITY",
        "price": 8.19,
        "change_pct": 1.11
      }
    ],
    "note": "x"
  },
  "sources": [
    {
      "title": "Trade.gov",
      "url": "https://www.trade.gov/x",
      "year": "2019"
    }
  ],
  "charts": {
    "layers": [
      {
        "label": "Eating out (PFA via Trade.go",
        "value": 7.5
      },
      {
        "label": "Registered restaurants",
        "value": 2.5
      },
      {
        "label": "Pakistan Food market",
        "value": 115.4
      }
    ],
    "product_scores": [
      {
        "label": "Packaged biscuits / cookies",
        "value": 90
      },
      {
        "label": "Bread / bun / rusk",
        "value": 88
      },
      {
        "label": "Cakes / celebration bakery",
        "value": 84
      },
      {
        "label": "Savory snacks / namkeen bakery",
        "value": 80
      },
      {
        "label": "Premium / health bakery",
        "value": 66
      }
    ],
    "gap_scores": [
      {
        "label": "Planner-grade demand forecast pa",
        "value": 84
      },
      {
        "label": "Cited market-size dashboard",
        "value": 88
      },
      {
        "label": "Listed-supplier risk watch",
        "value": 82
      }
    ]
  },
  "ml_notes": "Scores are transparent heuristics (content-fit style). Replace with survey + sales data for production forecasting.",
  "crawl_meta": {
    "evidence_count": 1,
    "mode": "groq",
    "symbols": [
      "UNITY"
    ],
    "completed_with": "groq+offline-fill",
    "repaired_at": "2026-09-12T20:05:10.920Z",
    "repaired_from": "thin-stored-report"
  }
}